Title,URL,Description,Decade of origin,Related Artworks,Key motifs,Key colours,Visuals
Sigma,https://aesthetics.fandom.com/wiki/Sigma,"Sigma is an internet meme and character trope that emerged in the late 2010s, based on a hirearchically superior category of the pseudoscientific ""alpha"" and ""beta"" male dichotomy.[1] The so-called ""Sigma Males"" are often portrayed as lone wolves, independent, powerful, solitary, mysterious, self-sufficient, wealthy, superficial, and constantly engaging in self-improvement.
The traits of the Sigma aesthetic are largely drawn from a very niche set of movies and shows, like American Psycho, Better Call Saul, Joker, The Batman, The Wolf of Wall Street, and many other works. The heaviest influences in this movement are Incels, an online subculture focusing on negative dating experiences and misogyny, and more indirectly Yuppies, which referred to American young urban professionals in the 80s (although most followers of the ""Sigma"" movement might not recognize this influence, as they associate it with American Psycho instead).
It is closely related to the concept of hustle culture, a societal mindset that glorifies excessive work and relentless ambition as the sole means to achieve success and self-worth. It promotes the idea that one must constantly be ""on,"" pushing oneself beyond limits, at the expense of personal well-being, relationships, and mental health.
By the early 2020s, it evolved into an actual internet movement and a meme, glorifying several public figures like Andrew Tate, Christian Bale and Elon Musk. However, this movement has been subject to criticism for its controversial aspects, including its ties to the Incel subculture, the glamorization of serial killers, the promotion of misogyny and toxic masculinity, its unrealistic expectations of men based upon works of fiction, and its association with right-wing political ideologies.
The movement is centered around the concept of a ""sigma male"", which is a term used to describe a successful man who is highly independent and self-reliant, often portrayed as a ""lone wolf"". The term is part of a social hierarchy of masculinity, which includes letters of the Greek alphabet like ""alpha"", ""beta"", ""gamma"", ""delta"" and ""omega"", making up the other categories.
The term ""sigma"" used in this context was first recorded in 2010, particularly in a blog written by Vox Day, a controversial author known for his alt-right and white supremacist biases. The second record of the term is The Sigma Male: What Women Really Want, a book published by John T. Alexander in 2014. The term began to expand to YouTube in 2018, when content creators focusing on toxic masculinity began to create video tutorials on ""how to be a sigma male"" or ""how to tell if you're a sigma"".
It recently gained popularity in the early 2020s alongside the rise of Gym Culture on social media platforms like TikTok and Instagram, where the aesthetic is often associated with Drift Phonk music. One of the key aspects is physical fitness, and many people striving to be ""Sigma Males"" attempt to achieve a muscular and toned physique through frequent exercise and strict diets, as they associate that with ""success"" and ""masculinity"".
Andrew Tate is the most well-known figure of the ""Sigma"" movement, and his videos reached infamy for promoting hyper-masculinity and financial success. He posts content showcasing his wealth, like his luxury cars (especially Bugattis) and portraying himself as economically successful. He was criticized because the TikTok algorithm selectively showed his videos to children as young as under the age of thirteen, and some of his videos had misogynistic or propagandistic remarks.
The Sigma aesthetic is commonly parodied and satirized, even by those who actively participate in the communities surrounding it. Characters like Mr. Bean and Paul Blart from Paul Blart: Mall Cop are often called ""sigma"" or ""chad"" due to their ridiculous behaviors, which is often referred to as the ""sigma grindset""; this is in part due to the fact that Sigma Males are sometimes stereotyped as behaving erratically, oblivious to the insanities they revel in due to their sense of masculinity, and their egotistical personality.
By late 2023, the term Sigma had evolved into a satirical husk of its former nature (particularly through ""Gen Alpha Brainrot"" memes). One notable example of the Sigma phenomenon being mocked includes ""Sticking out your Gyatt for the Rizzler""; the song was popularized on TikTok and includes references to Gen Alpha children overusing the word ""sigma"" online with the intention to sound mature. Another popular catchphrase popularized in 2024 is ""erm... what the sigma?"".
The aesthetic associated with the Sigma character trope is defined by the juxtaposition of visuals that evoke power and solitude at the same time, also known as the ""Lone wolf"" trope. It frequently features persons or influencers who have achieved success and wealth, such as Andrew Tate or Elon Musk, or fictional characters known to be rebellious, like Patrick Bateman from American Psycho, Batman, or the Joker.
The color palette seen in Sigma edits is pretty limited and typically includes black, white, various shades of grey, red, and burgundy red, also using color filters, including high contrast, darkness and bold lighting. Accents of deep red, like burgundy, are also very common.
Occasionally, the aesthetic incorporates elements of Corporate culture, like offices, cityscapes, and business attire – this is thought to come from references to the American Psycho film, released in 2000, which was itself heavily based upon a satirical depiction of the American Yuppie subculture.
The Sigma movement is mainly criticized for its unrealistic and unachievable portrayal of masculinity, as these gender roles often rely on works of fiction and not real life. Fictional characters like the Joker and Patrick Bateman from American Psycho are often cited as inspiration for sigmas,[2] mainly because of their charisma and disregard for social norms, but at the same time they are villains and sociopathic individuals and should not be used as role models outside of fiction. American Psycho in particular is a satirical movie,[3] something which many people participating in this aesthetic have missed, and Patrick Bateman's actions are not meant to be taken seriously or imitated in real life. Despite this, many young male TikTok users have been known to attempt to copy his workout routine.[4] Toxic masculinity can also be noted in this stereotype with their focus on being a ""lone wolf"" and isolating yourself in favor of self-improvement or financial success.
The concept of a Sigma is also deeply connected to the Incel ideology. Both groups are more prone to becoming politically radicalized, and ""looksmaxxing"" is a term shared by both communities that originated in Incel forums and later came to be associated with Sigmas as well.[5] It refers to attempting to enhance your physical appareance and beauty to the maximum through various pseudo-scientific methods, like ""mewing"", placing spoons under the eyes, diets, excessive exercise, and even surgery and so much more. This shows that both sigmas and incels have unrealistic expectations of masculinity and self-concept, valuing their appareance but completely ignoring their social behavior or maintaining a positive reputation. Another common trait between both communities is the prevalence of misogyny, as both are more likely to objectify women or believe they are ""inferior"" to men. Sigmas in particular also tend to romanticize the idea of manipulating women.
The admiration of serial killers and mass murderers is another problematic aspect of the ""Sigma"" trope.[6] Various followers of this aesthetic, who may also consider themselves part of the online True Crime community (abbreviated as ""TTC""), have been known to romanticize and idolize notorious killers like Ted Bundy, Richard Ramirez, Adam Lanza, or the Columbine Shooters, sometimes even creating aesthetic edits and videos of their pictures. This type of admiration for criminals, professionally known as hybristophilia, is often based on a fascination with the killer's perceived intelligence and charisma. However, they tend to ignore the fact these persons have commited crimes and murder, trivializing the experiences of the victims as well as any other people, schools and communities personally or emotionally affected by those tragedies.
Sigma propaganda videos are also known to be homophobic, since they tend to portray members of the LGBTQ+ community as ""stupid"", ""weak"", ""effeminate"", or trying to ""push"" their opinions on others. One example would include LionRuler, who got terminated on YouTube for violating the platform's terms of service.
This aesthetic is often accompained with musical genres like Drift Phonk and Hardstyle remixes due to the the association between them and 2020s gym culture. Electronic music with a ""dark"" vibe is also really prevalent. Most songs associated with ""Sigma"" edits are generally popular TikTok audios.",Late 2010s,,"Loneliness, self-improvement, suits, looksmaxxing","Black, white, red",
Silicon Dreams,https://aesthetics.fandom.com/wiki/Silicon_Dreams,"Silicon Dreams, also known as Old CGI or Retro CGI, refers to the surreal and uncanny visuals seen in early CGI animations, art and videogames from the mid-1980s to early-2000s.
Computer-generated imagery (or CGI for short) and its origin can be traced back to the Late 1950s and 60s, when computers were able to render lines and patterns. But the conventional idea of ""CGI"" as we know today wouldn't start until the 1970s, were they started to generate 3D models for the first time. A notable example from the time being ""Computer Animated Hand"" from 1972, which is considered the first 3D computer animation to be ever created.
By the 1980s, CGI began to technologically evolve at a faster rate and slowly being introduced to the mass public through advertisements and TV bumpers. It was also during this time when the common attributes associated with Silicon Dreams start to become a lot more apparent, with demos like Quest (1985), Brilliance (1985), Mental Images (1987), Deja Vu (1987), Polly Gone (1988), and the first Pixar shorts like Luxo Jr. (1986), Tim Toy (1988), and Knick Knack (1989).
During the following decade, the 1990s, CGI starts to get into the mainstream media, with new blockbuster movies and TV shows beginning to adopt these technologies, since it was starting to get more commercially viable then ever before. All of that led to the release of the first CGI feature-length animated film Toy Story in 1995, and Cassiopeia in 1996, which furthered the advancements in CGI that were happening in the 90s.
Despite the leaps in CGI technology between the 80s and 90s, there was a consistent visual identity that was present in 3D animation. It was characterized by sparse landscapes or architecture, low-resolution textures, simple visual effects and objects, environments, and 3D models that are surreal and ""out of this world"" in nature, like something that came out of a dream.
Silicon Dream ended by the Mid-2000s when CGI in animated movies, shows, and advertising became advanced enough and the norm of the industry (i.e. Frutiger Aero). In the 2010s, the aesthetic had a revival on the internet by the rise of aesthetics like Vaporwave and Seapunk, which ended up being used as a tool to complement the visuals of these aesthetics or to create a sense of nostalgia of a bygone time.
Silicon Dreams often includes images, artwork, and shorts made with early CGI from the 80s to 90s, a majority of them being Sci-Fi themed, landscapes or even CGI architecture. A lot of imagery included simplistic polygons, textures, and lighting, due to the technical limitations of the time. It specially includes images made in the computer program Bryce 3D.
The Silicon Dreams aesthetic was also commonly seen in Trapper Keepers of the 90s; loose-leaf binders made by the stationary company Mead that were used for the sake of organizing school supplies for students. This could also be seen as the connecting tissue between it and more modern-ish aesthetics such as Vaporwave, Seapunk, Icepunk, Slimepunk, and Y2K Futurism.
At the time when Silicon Dreams started, many people used computers to generate imagery.
In the 2010s, Silicon Dreams was utilized as an element in Vaporwave music/aesthetics, be it from Oneohtrix Point Never's music video for Nobody Here (which some pinpoint as the very first example of Vaporwave music put out into the wild) as well as the music video for Macintosh Plus's Lisa Frank 420. The Vaporwave connection could be considered a carryover from when the Seapunk community gravitated towards Vaporwave after its decline in popularity, where Seapunk was heavily inspired by many early works within the Silicon Dreams style of aesthetics (due to many members of the community being children at the time Silicon Dreams was first conceived) which added to the sense of nostalgia that both Seapunk and Vaporwave evoke.
Dire Straits - Money For Nothing (Official Music Video)
The music video for Dire Strait's Money for Nothing included early CGI animation in it, as well as Miley Cyrus's music video for We Can't Stop also utilizing clips from the earliest known example of CGI animation (a simple talking face attempting to show emotion and ""talk"" that was made all the way back in 1974). Many Seapunk music videos (specifically from the likes of Ultrademon) utilize a more ""high definition"" variation of the early Silicon Dreams works of the 1990s.
In the late 2010s and 2020s, many Intelligent Drum and Bass/Jungle albums and Low Poly YouTube mixes feature CGI of the Silicon Dreams aesthetic (most notably, the Peshay Studio Set (1996)). Jungle is a more advanced and Y2K Futurism-oriented sound, compared to the more primitive, Late 80s/Early 90s New Age sounds of Vaporwave. Some of the notable Drum and Bass/Jungle artists related to this aesthetic being Inner-Vation, LTJ Bukem, Total Science, and Funky Technicians.
In terms of its usage in early media of the 90s, there was a certain level of what could be described as ""janky"" in this particular era of CGI animation, due to the technology still being extremely new and, as such, still in an extremely primitive state.
Because CGI was fairly new in video games in the '90s, 3D video games have low-poly graphics, meaning that the meshes in games do not have many polygons to create a smoother model.","1970s (first came into prominence in the 1980s)
",,"Early CGI Animation / art, surreal environments and 3D models
",,
Slavic Violence Tumblr,https://aesthetics.fandom.com/wiki/Slavic_Violence_Tumblr,"Balkan Violence Tumblr is a theme many Tumblr users used for their aesthetic blogs. In this aesthetic community, people had blogs where they posted and reblogged photos of paramilitary groups from Russia and the Balkans, Russian Orthodox Christian iconography, gore, drugs, weapon collections, and Bondage photos. Many blogs can also include and intersect with photos of the Irish independence movement, WWI and WWII, Middle Eastern terrorist organizations, Soviet Nostalgia, Sacricore, and White Trash aesthetics.
Under Construction
This internet aesthetic later declined because of the Tumblr Purge of late-2018.[1] Because of the aforementioned NSFW elements, many of these blogs were deleted, had their photos removed, and many people left this aspect of social media altogether because of a lack of aesthetic blog-oriented platforms free from bans on violent subjects. However, some aesthetic blogs still remain on Tumblr, albeit with less gore and sex than before the purge.
Most of the images in this aesthetic include young men from Eastern European nations who are in the military, as indicated from their clothing and shaved heads.
Balaclavas are also incredibly common in this aesthetic, with many people, including non-military users, doing photoshoots where they wear these and make intimidating poses.
These photoshoots can also involve women, who are often delicate and blonde, which fits into the Eastern European connotation. These women would be in a sexual situation as submissive towards the male, who would be a person fitting into the aesthetic as per the above description. These women often fit into the Slavic Doll aesthetic as well as being connected to the Morute aesthetic.",Mid-2010s,,"Paramilitary groups, gore, Bondage, weapons, drugs","Black, army green",
Sleepycore,https://aesthetics.fandom.com/wiki/Sleepycore,"Sleepycore (also known as Sleepcore) is a aesthetic that focuses on images that involves things associated with bedtime or sleeping. It is similar to Yume Kawaii, minus the kawaii imagery. It is commonly depicted with dreamy nostalgia.
Sleepycore is based around imagery mixed with plushies, stuffed animals, and pastel colors. It is rarely mixed with Yume Kawaii. But unlike Sleepycore, Yume Kawaii focuses on Japanese kawaii imagery, while Sleepycore does not.",2000's,,"Stars, stuffed animals, pastel colors","Yellow, purple, blue, pink",
So Retro,https://aesthetics.fandom.com/wiki/So_Retro,"So Retro is an ironic phrase referring to a meme aesthetic that largely originated as a result of artists trying to replicate the 8-Bit (sometimes 16-bit) style as an attempt to make their games and/or art look nostalgic, but fail or put no effort into actually doing so. This results in an inaccurate style that doesn't capture the essence of retro games.[1]
Most of the time, it represents low effort, poorly-made pixel art that look kitschy and tacky; so alternatively, this aesthetic can also be called ""Trashy Retro"" or just ""Retrocore"". Anything that can be described as ""So Retro"" may take inspiration from extremely popular games deemed old, such as Super Mario and Sonic the Hedgehog. The aesthetic often includes the MS Paint aesthetic with poorly made drawings in the MS paint program.
The aesthetic may have originated from YouTube user mint301 who created a series titled How to Draw Like a Pro With Paint, which included satirical ""tutorial"" videos on how to poorly copy a sprite from a Retro game in Microsoft paint.
In 2023, the term ""So Retro"" was coined for the aesthetic and gained popularity as a concept within the YouTube animation community[2]. A gif became popular showing sprites from Mario poorly animated, and became associated with So Retro even though it did not incorporate any poorly made pixel art.
The term has been expanded from Pixel Art to refer to games that use the retro Low Poly aesthetic combined with more modern graphical elements which may create an odd feeling, even though this may be an intentional artist choice.",2000s,,"Poorly-made pixel art, inaccurate nostalgic designs","Any 8-Bit colors, usually inaccurate",
Soft Grunge,https://aesthetics.fandom.com/wiki/Soft_Grunge,"Soft Grunge or Pale Grunge is an aesthetic based on simple photos with a color palette primarily consisting of white, grey, black, green, and blue. The aesthetic is believed to have appeared on Tumblr between 2013 and 2015. Some photos are intended to be sad looking, often of someone suffering for love or with a '90s vibe, for example.
Despite calling themselves grunge, followers of the aesthetic were fairly popular in the mainstream and connected to the rise of the Alternative, emo, pop, and indie music and fashion trends of the time, such as galaxy prints, black and white grids, and fandom merchandise. Because of their close-knit community on Tumblr, they developed a ""not-like-other-girls"" attitude, especially in contrast with the ""hipsters"" The type of media they consumed was also incredibly specific, with fangirl culture and this aesthetic often overlapping. This style later declined, yet has gained short-term popularity in 2020 due to a desire to escape to the past.[1]
This aesthetic can be described as very fresh or a clean variation of the grunge style. Enthusiasts of this aesthetic focus on taking pictures that contain:
A basic look
The style associated with 2014-era Tumblr has a very defined color palette in that it is typically monochrome or pastel, depending on personal preference. Japanese fashion, early 2000s emo, and more authentic grunge influenced the style, which has outfits that were incredibly specific, almost formulaic. Unlike grunge or the DIY ethos of other alternative fashions, these pieces were typically bought brand new at mall stores such as American Apparel and Hot Topic. Despite the term ""Tumblr girl"" being the most popular term, men can wear the aesthetic too. Soft grunge outfits are now often associated with bisexual people and LGBT fashion. Typical fashion pieces include:
The main store of the aesthetic
Stores that are popular among members of the Soft Grunge community include:
Space buns are two high buns.
Coloured or faded hair is great for this aesthetic, but natural hair also fits very well. Also hairstyles and haircuts like:
A lot of plants.
To decorate your living space in the Soft Grunge way, here are some quick tips to achieve this aesthetic quickly.
Lana Del Rey and Arctic Monkeys
A lot of Soft Grunge music tends to fall into the Indie category.",2010s,,,"Black, white, grey, blue, green",
Soft Macabre,https://aesthetics.fandom.com/wiki/Soft_Macabre,"Soft Macabre is an aesthetic that evokes both creepiness and softness at the same time. Unlike something like Pastel Gore, Soft Macabre is purely black and white, and is usually more about photography than it is art. Soft Macabre is grungy in its visuals, with grains and other messy filters being a key part of the Soft Macabre aesthetic.
Soft Macabre photos have creepiness with soft vibes co-existing. Images are given a black and white filter, and then a grainy filter over it. The point of Soft Macabre is to evoke the feelings of sadness and loneliness in what may just be normal or even happy images.
Soft Macabre borrows from dark alternative fashion, such as emo or goth, and adds ""softer"" or ""cuter"" arrangements. Soft Macabre may also influenced by grunge fashion. It may be similar to aesthetics such as pastel goth or soft grunge.",,,,"Black, grey, white",
Southern Gothic,https://aesthetics.fandom.com/wiki/Southern_Gothic,"Southern Gothic is a literary genre encompassing fashion inspired by the culture of the American South. It originated in works by 19th-20th century Southern authors criticizing their society's racism, sexism, classism, fixation on the past, and decaying economy.
Later the aesthetic deviated from literature with the ""regional gothic"" trend on tumblr in the mid-2010s, which places greater emphasis on liminal spaces, modern American iconography, evangelicalism, and controversially, hillbilly horror. Because of this, this entry is divided into two sections, with one based on the literary movement and the other on the tumblr revival.
A few movies in the 2000s have gone against the harmful tropes revolving around “evil hillbillies and evangelicals in the South”, such as 2010’s Dale and Tucker Vs Evil. This is still a rarity, though, and is definitely a sociological issue that needs to be better addressed.
This section is under construction
The aesthetic begins in literature which depicts and criticizes the American South. Hence, the general culture of the American South is necessary background. Note that this is not at an academic level and only provides context for the aesthetic.
This culture was a slave-society, where the culture is defined by the practice of slavery, with all its aspects being embedded in politics, economics, popular culture, etc[1]. Therefore, there was often a general exposure to cruel punishments used on slaves, anxieties over slave revolts, and the use of grotesque imagery to dehumanize black people.
Southern societies also emphasized gentility in families, with wealthy families acting somewhat like European nobility, wherein marriages and blood relations were highly important in capital such as owning slaves and a grand estate[2]. Of course, this lends well to the use of incest, decadence, and domestic violence.
Many scholars point to Henry Clay Lewis and Mark Twain as the first to include Gothic tropes in their depiction of the American South.
The Tumblr aesthetic began when Tumblr user user clive-gershwin-palmer in January 2015, created a post that is now deleted.[3] Presumably, it follows the same format as other ""Regional Gothic"" posts, where they write about their regional culture in bullet-pointed prose mimicking Welcome to Nightvale, a podcast wherein a fictional radio host nonchalantly describes cults, Eldritch abominations, and cosmic mysteries in their small town in New Mexico. The trend then picked up in March 2015, with user korvidian created a post entitled ""south-east queensland gothic""[4].
With the popularity of the Regional Gothic trend, people from the American South drew upon bedtime stories, urban legends, and Southern culture in their text posts. The Regional Gothic later developed a visual component, as people uploaded photos of Christian billboards, abandoned churches, and other things in the visuals section. With Southern Gothic in particular, there were many playlists created on the then-popular site 8tracks.com; many creators shared their playlists on tumblr and gained virality.
This interpretation of the aesthetic slowly fizzled out, like many other social media aesthetics do.",19th Century,,"Criticism of prejudice, decay, past vs. future",,
