Title,URL,Description,Decade of origin,Related Artworks,Key motifs,Key colours,Visuals
Femcel Weeaboo,https://aesthetics.fandom.com/wiki/Femcel_Weeaboo,"Femcel Weeaboo is an aesthetic and internet subculture that is primarily composed of and depicted by teenage girls who identify as both Femcels and Weeaboos. These young women often turn to anime and manga as forms of escapism from their daily lives, frequently presenting online as mentally ill NEETs (Not in Education, Employment, or Training) without real-life social circles or romantic partners.
However, this aesthetic is mostly an internet persona and doesn't necessarily reflect their offline life. The aesthetic is most commonly found on platforms like Tumblr, TikTok, and Pinterest, where they share images from Japanese media and memes, typically revolving around topics of mental illness and existential dread.
This online subculture is characterized by a very specific taste in anime and music. They frequently identify with and relate to fictional characters with troubled backgrounds or those exhibiting traits of mental disorders. Some examples of media popular within this community include Serial Experiments Lain, Needy Streamer Overload, Evangelion, WataMote, and Puella Magi Madoka Magica. Musically, genres like Indie Rock, Breakcore, and Lolicore are prevalent among femcel weeaboos.
The people that express this aesthetic combine multiple disparate elements that express feminine interests, otaku culture, and depictions of mental illness. For example, a blog may contain things that show a weeaboo lifestyle back-to-back, or in phases. These images tend to be of more candid quality, with the lighting being harsher and more blue, as it is less polished in appearance.
The more kawaii-oriented side of the aesthetic may pair these themes with girly imagery, cursive texts, pink pastels, kawaii mascots like those on Sanrio products, and soft colors. The images posted often are edited with anime girls and male love interests from popular anime.
Due to the popularity of nostalgic 90s anime within the community, art posted in femcel communities tend to have edgier tones attached to a typical cute Moe archetype. Sketchy lines and rendering, harsh black-white contrast, and dark themes (self harm, ero-guro, denpa media, drug use, mental illness, etc.) are added in conjunction with an old school loli-esque art style. This art style is popular amongst Lolicore music artists.
A more recent branch of this aesthetic, often called ""4chancore,"" features exaggerated references to early internet culture, particularly imageboard sites such as 4chan. However, this is despite the fact many Femcel Weeaboos are too young to have experienced these times of the internet firsthand. This behavior is often jokingly referred to as ""LARPing"" (short for Live Action Role-Playing), describing their feelings of anemoia for a bygone era of the internet.
This trend of 4chan-inspired content frequently incorporates anime characters and meme references that were popular in imageboards during the late-2000s. It was popularized by artist ""Lottie,"" also known as ""canihavepromo,"" whose artworks combine 2000s anime with Flash animation styles reminiscent of 4chan. Despite being 16 at the time and never having used 4chan, her depictions were considered remarkably accurate. However, Lottie was eventually deplatformed for her problematic behavior, and other artists copying her art style (known as ""Lottie clones"") have emerged on TikTok.
Arguments against the Femcel Weeaboo aesthetic often overlap with criticism of Waif, though with some distinctions. Both aesthetics are criticized for their toxic depictions of feminity and mental illness, but Femcel Weeaboo tends to focus more on fictional content rather than real-life issues. The discussions surrounding anorexia and eating disorders that are prominent in the Waif community are less prevalent in this aesthetic.
Criticism often revolves around the community's interest in taboo topics, including manipulation, gore, pedophilia, shut-in lifestyles, negative portrayals of schizophrenia, and the more recent obsession with 4chan. For instance, controversies arose on TikTok surrounding Femcel Weeaboos creating catfish accounts and labeling themselves ""IRL lolis."" Loli is a term within Otaku culture used to describe young female anime characters, and it is often considered inappropriate or predatory due to its association with pedophilic content. This ties into the aesthetic's association with Lolicore, a subgenre of Breakcore and J-core music popular within the community, which, while not inherently sexual, can be seen as problematic due to its name.
Another common theme is the depiction of gore, often presented in a style similar to Cutecore. These topics are often used as a form of venting or frustration with trauma. Some have drawn parallels between this and the psycho-erotic horror found in Denpa media and other forms of psychological horror.
The connection between Femcel Weeaboos and the larger, controversial Incel subculture remains loosely defined due to the aesthetic's recent emergence. However, it's worth noting that incels often assert that women cannot experience ""inceldom"" or ""involuntary celibacy,"" which they describe as the state of being unable to find a partner despite desiring one. Thus, they fully exclude women from their community.
The anime and manga watched by this community tends to fall into either a darker tone that is notorious for 90s denpa or psychological horror and the philosophical issues presented in them, or anime that heavily uses moe tropes. Most anime that people of this subculture make memes and jokes featuring characters from is Neon Genesis Evangelion and Serial Experiments Lain, however most anime made in the early 2000's to late 1990's can be featured. The more kawaii-oriented side of the aesthetic features series from shoujo and idol anime, video games and visual novels targeted at girls. These are often from music-related games like Project Sekai or Love Live!, but other series are also popular.",2020s,,"2000s anime, nihilistic phrases/captions, early 4chan references",,
Foodie,https://aesthetics.fandom.com/wiki/Foodie,"Anime Food, the most aesthetic of food art. Foodie is a gourmet or a person who has an ardent/refined interest in food and alcoholic beverages. It involves seeking new food experiences as a hobby rather than simply eating out of convenience or hunger. The Foodie aesthetic, however, is dedicated to showing off these foods in very aesthetically pleasing manners. You may also take note of the color combinations, plating arrangement, and composition in their photographs.
There are also multiple ways of engaging as a foodie, with different cuisines, trends, and likes. Multiple social media circles and cultures have content relating to food, and how the different foods are photographed and framed will also differ.
Why Does Food in Anime Look So Good - Why, Anime? - Get In The Robot
A breakdown of food in anime and why it always looks so good.
Most foodie shows provide a strong emphasis on food. Be it cooking shows, shows that involve a host traveling to different locales to sample the food of a particular restaurant, reality shows centered around cooking, or works of fiction centered entirely around food, such as the anime Food Wars or the Jon Favreau movie Chef. On top of this, there are several popular YouTube channels that Foodies will watch what generally falls into the same category as examples mentioned above of shows and movies.
Bakery is a subgenre of foodie based around bakeries, bread, and confectioneries from bakeries. There is potential for it to cross over with Lovecore (because what says ""I love you"" more than fresh baked goods). There's even a mild home for Bakery aesthetics with the various Academia aesthetics because what better way to help you focus on studying (besides some chill music) than some baked goods and coffee?
Candycore is an aesthetic that involves bright clothing, bright colored bracelets and other accessories, braided and brightly dyed hair. Candycore also includes raving, childish things, and types of candy.
For more information on this subgenre, please check out our Candycore page.
Fruitcore is a subgenre of foodie that revolves around fruit, berries, and dishes made of them.
Gummywave is primarily associated with partially translucent edible/seemingly edible objects that are visually related to gummy snacks. These include fruit snacks, gummy bears, gummy worms, sour straws, and Gushers.
One of the most popular types of food content is ""unhealthy"" food, typically associated with American sports bar and grilling culture, served in excess. This includes bacon, burgers, macaroni and cheese, deep-fried foods, barbecue, nachos, etc. These foods will have multiple elements combined with each other, like a burger with macaroni and cheese on it, for example. The food is also typically served in an impressively large quantity.
External links to help get a better understanding of this aesthetic.",2010s,,Food presented in artistic and aesthetically-pleasing ways,,
Fotonight Web,https://aesthetics.fandom.com/wiki/Fotonight_Web,"This article is part of a series on the Frutiger Family
Fotonight Web is a meme aesthetic based on Frutiger Aero, which originated from a dream that a user from the subreddit r/FrutigerAero had. It's characterized by the use of nature, low quality image montages, Chinese knockoffs and imagery. It's ""serious"" form comprises of cheap, tacky, low-quality Frutiger Aero use, see the gallery for examples.
On January 2, 2023, a Reddit user named u/williamsaguaro2002 had a dream related to Walt Disney Studios and Frutiger Aero. In that dream, the user got a voice acting job at Disney for a ""big purple fish"" character, but the studio was located on a underground secret base, which had aliens and nuclear weapons. Later, he stumbled across an old Asian man talking about ""Fotonight Web"", alongside a image associated to it above, although he doesn't remember what the senior said.
On January 3, 2023, he made a post on Reddit (see here) illustrating what he saw in his dream and later detailing what happened in it. This led to the creation of the subreddit r/FotonightWeb, housing a community surrounding the premise of this aesthetic.
Although this is the origin how ""Fotonight Web"" got its name and its associations from, their visuals can be traced back to the 2000s and 2010s, when it was commonly used in Chinese websites and knockoffs. The aesthetic is unintentionally really similar to ""Too Cool,"" a fashion movement from China that reclaims elements of rural culture.
The visuals of Fotonight Web consist of similar ones seen in Frutiger Aero such as Skeuomorphism, glossy textures, ""humanism"", use of nature, bokeh, bubbles, glass, and auroras. These are combined with faucets of chinese internet culture such as Xpiritualism and Shanzhai. Shanzhai in particular emphasizes the counterfeit, imitation, or parody products aspect of Fotonight Web.",2000s/2020s,,"Nature, Glossy Textures, Skeuomorphism, Low Quality Image Montages, Non-Sensical/Dream-like Visuals, Chinese Bootlegs/Knockoffs, Foreign Languages (mainly Chinese), imagery related to Chinese culture, Mickey Mouse and Disney related imagery","Blue, Green, Yellow, White, Orange, Fuchsiai.e. Tertiary color palette
",
French Girly (Japan),https://aesthetics.fandom.com/wiki/French_Girly,"French Girly (フレンチガーリー) is a substyle of Japanese Girly Kei fashion and an aesthetic created by and popular among young women in Japan. It is an elegant and feminine aesthetic that utilizes imagery associated with antique French Haussmann architecture and material culture, combined with whimsical and kawaii details. This type of fashion is largely inspired by luxury brands and prep, but takes on an extremely girly look that is fairly unique to Japanese culture.
This style can be commonly found on Instagram and has been reported on by Japanese fashion magazines as well as online sites aimed at young women. French Girly also centers around the clothing of various indie brands that gained notoriety for creating and catering to this aesthetic, largely by the brand Epine.
As the fashion part of the aesthetic is derived from Japanese Girly fashion, it closely follows its typical silhouette while also integrating elements associated with parisian fashion(see pink parisian), such as:","late 2010s
",,"Vintage French architecture, roses, girly fashion
","Pink, beige, white, black
",
Frutiger Aurora,https://aesthetics.fandom.com/wiki/Frutiger_Aurora,"Frutiger Aurora is a subgenre of Frutiger Aero that focuses on the aurora visual; an aurora is a natural light display in Earth's sky, predominantly seen in high-latitude regions (around the Arctic and Antarctic). Auroras display dynamic patterns of brilliant lights that appear as curtains, rays, spirals, or dynamic flickers covering the entire sky. Frutiger Aurora emerged in the Early-2000s towards the end of the Y2K Futurism era and maintained it's popularity into the Early-2010s.
Frutiger Aurora first started to appear at the same time as Frutiger Aero. This was near the end of the prominence of the Y2K Futurism aesthetic (c. 1997-2004). Frutiger Aurora's first major appearance was in Mac OS 10, in which it appeared as a series of wallpapers. Frutiger Aurora gained popularity along with Frutiger Aero in the Mid-2000s and lasting into the Early-2010s, mainly in the form of wallpapers as previously seen with Mac OS 10. Microsoft prominently used Frutiger Aurora as part of their ""Windows Aero"" design language; this design language can be seen in Windows Vista and Windows 7.
During the Mid-2010s (c. 2012-2013), the ""Frutiger"" line of aesthetics were beginning to fall out of popularity. In 2015, Microsoft released their new OS at the time: Windows 10. Windows 10 abandoned the ""Windows Aero"" design language for a more simple look. By 2017, Flat Design had come into mainstream popularity, and Frutiger Aero was replaced.
Frutiger Aurora depictions commonly include patterns similar to auroras, beams of light, bokeh, lens flare, gradients, and dynamic patterns. The visuals inspire a calm and tranquil feeling symbolized by the wavy patterns found in Frutiger Aurora images. This sentiment is also intensified by the immense beauty of auroras in the real world, which Frutiger Aurora takes after. Other types of images of this aesthetic can also carry a sense of technological advancement and movement, similar to Abstract Tech, but one that still reminiscent of nature itself, evident by the fluidity of the visuals. Frutiger Aurora images often only contain a few colors, which are often close in hue, some images utilize contrasting colors, however, straying from the former color palette.",2000s,,"Auroras, Beams of light, Bokeh, Lens flare, Gradients",,
Frutiger Eco,https://aesthetics.fandom.com/wiki/Frutiger_Eco,"Frutiger Eco is a broad sub-aesthetic of Frutiger Aero. It focuses on renewable energy, living in harmony with nature, while also incorporating futuristic themes and architecture centered around nature and sustainability. Frutiger Eco was a popular aesthetic prevalent in images, advertising, graphic design, etc., of the Mid-2000s and Early-2010s that tried to spread awareness of climate change while also encouraging optimism in the form of images portraying a utopian, eco-friendly and advanced future; these motifs are similar to Solarpunk. Frutiger Eco is separated from these aesthetics as it more falls in-line with the visuals and history and of Frutiger Aero. Frutiger Eco's name comes from its father aesthetic, Frutiger Aero, and the prefix (not used as a prefix in this context) ""eco"", meaning ecology or the environment.
For more information, see: Frutiger Aero
Frutiger Eco gained popularity in the Early to Mid-2000s along with Frutiger Aero, both aesthetics utilizing bright and glossy futuristic look to inspire feelings of hope for the future. Frutiger Eco in particular embodied this sentiment using imagery associated with both the future and nature to create a futuristic, utopic feeling. This sense of futuristic eco-friendliness was in response to the growing worries of climate change at the time (these worries still persist today) and Frutiger Eco (along with Frutiger Aero and its sub-aesthetics) aimed to quell these worries and encourage optimism. This led to Frutiger Eco being largely adopted by corporations, its imagery being used to push the values of eco-friendliness and sustainability. During this time, a more corporate version of Frutiger Eco appeared known as Renewable Corporate Futurism.
Along with Frutiger Aero, in the Mid-2010s Frutiger Eco started to lose traction as an aesthetic and a design style. By 2017, with the popularization of Flat Design, the ""Frutiger"" look had lost most of its mainstream popularity.
However, Frutiger Eco still persists and is still quite popular in the realm of cleaning product logo design.
Main article: Renewable Corporate Futurism
Renewable Corporate Futurism (RCF) also known as Stock Eco Office, Stecoffism, or Solargraphic is a subgenre of Frutiger Eco, Frutiger Aero and Corporate. Renewable Corporate Futurism promoted environmental positivity during a time when global warming was (and still is) a great issue. It combines the utopic futurist, humanist, naturist themes of Frutiger Aero and Eco with Corporate office based imagery and values. RCF came to prominence in the Late-2000s and lost popularity in the Late-2010s.
Frutiger Eco's visuals are a unique blend of advanced technology and nature, with a strong focus on sustainability and eco-friendliness (similar to Solarpunk). The futuristic cities depicted in Frutiger Eco showcase (sometimes, but not always) futuristic technology with a focus on including renewable energy sources (such as solar panels (a prevalent visual in Frutiger Eco) as well as plant life being included as part of the architecture of the buildings. The more corporate graphic design visuals for Frutiger Eco include depictions of the Earth (usually - but not always - green), solar panels, plant life such as trees, and general iconography related to nature and sustainability. Frutiger Aero's influence on Frutiger Eco manifests itself in the form of motifs such as glossy textures, ""humanism"", bokeh, bubbles, and abstract flourishes.",Mid 2000s-Mid 2010s,,"Solar panels, Earth imagery (usually edited to be green), Trees & Plants, Water, Futuristic architecture
","Green, Teal, White, Blue, Yellow
",
Frutiger Family,https://aesthetics.fandom.com/wiki/Category:Frutiger_Family,"The Frutiger Family (also referred to as the Frutiger Umbrella) are a group of aesthetics inspired by or related to Frutiger Aero.
The Frutiger time period encompassed the zeitgeist of the Mid-2000s (2004) to the Early-2010s (2013). Frutiger Aero and its related aesthetics/subgenres encompassed and dominated advertising, stock imagery, technology, web design, branding, and media during the period it was mainstream. The Frutiger era succeeded the Y2K Futurism era and preceded the Flat Design era, often being considered the middle ground between the two.
Frutiger Aero itself is increasingly broad leading the internet to assigning subgenres to Frutiger Aero to better understand it and its intricacies. As well as Frutiger Aero subgenres, this category will also list related aesthetics that contributed to Frutiger Aero subgenres' existence, or was popular alongside it.
A Frutiger Aero subgenre is an aesthetic that owes its existence to Frutiger Aero. These are aesthetics that generally follow both the history of Frutiger Aero (emerging in the Mid-2000s, declining during the Early-2010s) and the rough visuals of Frutiger Aero. Examples include: Helvetica Aqua Aero, Frutiger Eco, Dark Aero, and Frutiger Aurora.
There are many aesthetics that are related to Frutiger Aero, but don't directly owe their entire existence to it. These are usually aesthetics that were popular during the same era as Frutiger Aero (c. 2004-2013) that sometimes overlap with it, but are distinct enough visually and historically to be considered a different aesthetic. Examples include Frutiger Metro, McBling, Vectorflourish, Surfcrush, & High Cleancore.",c. (2001-)2004-2013(-2017),,"High Definition, Nature, Humanism, Futurism. Skeuomorphism, Aero Glass, Gradients, Glossy Textures, Auroras, Bokeh, Bubbles, Water, Grass, Abstract Flourishes. Web 2.0. 7th Generation Gaming (Early-8th Gen), Abstract Tech

",,
Future Funk,https://aesthetics.fandom.com/wiki/Future_Funk,"Future Funk (also known as Vaporboogie) is an aesthetic and sample-based House subgenre that developed from the Vaporwave movement. The genre usually samples 1970s and 1980s Disco and City Pop tracks and incorporates elements of Synth Funk and French House while still utilizes elements of the Vaporwave production, like altering the pitch of the samples and using high amounts of reverb.
Future Funk (also known as Vaporboogie) is an aesthetic and sample-based House subgenre that developed from the Vaporwave movement. The genre usually samples 1970s and 1980s Disco and City Pop tracks and incorporates elements of Synth Funk and French House while still utilizes elements of the Vaporwave production, like altering the pitch of the samples and using high amounts of reverb.
The aesthetic of Future Funk takes strong influences from Vaporwave, Animecore and City Pop. Its characterized by its use of 80s and 90s anime imagery, pastel colors, and Retro-like effects.
Visually, as popularized by the YouTube channel Artzie Music, Future Funk visual aesthetics are usually just a looped GIF of a classic anime set to the track (popular animes to utilize are Sailor Moon and Urusei Yatsura, although other classics will pop up like Dragon Ball, Lupin the 3rd, Mobile Suit Gundam, and Macross) so elements of Animecore and Kawaii to the visual aesthetics of Future Funk are extremely common, but it's also not unusual to find aesthetic cues from Vaporwave, Synthwave, and Lo-Fi either.
What is Future Funk?
A tale as old as time: what IS Future Funk?
As stated above, Future Funk takes musical cues from Vaporwave, French House (which gives it some very subtle connections to the poppier entries into the Synthwave genre), Nu-Disco, and Synth Funk to create fun, happy tracks to dance to, taking samples of old funk tracks from the 70's and 80's (bonus points for using Japanese funk music, which is very obscure compared to its American counterparts) and repurposing them in a manner similar to Vaporwave (to the point where Future Funk will often just be lumped in with the genre despite the very clear differences in musical philosophy between Future Funk and Vaporwave.) Future Funk is also heavily influenced by City Pop, Japanese New Wave, and 80s British Synthpop (particularly the likes of Japan the band), and as Future Funk has grown as a genre, these influences have become more pronounced. GIF videos are made for these songs by YouTube channels like Neon City Nightlife.",2010s,,"Magical anime girls, good vibes, fun","Pink, blue, cyan, purple, yellow",
