Title,URL,Description,Decade of origin,Related Artworks,Key motifs,Key colours,Visuals
2014 Girly,https://aesthetics.fandom.com/wiki/2014_Girly,"2014 Girly Tumblr is an aesthetic seen in 2014 Tumblr. It centers itself around visuals that girly Tumblr bloggers found popular at the time. It embraces girly traits and colors, such as pale pink, white and mint, as well as brands, celebrities, room decor trends, foods, etc. that would be aspirational and overtly feminine.
The aesthetic has resurfaced on social media app TikTok in around Summer 2024, likely due to users longing for its energy it gave.",2012-2016,,,"Various shades of pink, cream white, beige, and mint",
2014 Tumblr,https://aesthetics.fandom.com/wiki/2014_Tumblr,"2014 Tumblr is one of the biggest influences to the contemporary aesthetics movement. As an image-aggregating site, it allowed people to curate personal reblogs easily. The ability to create a customized theme for the blog also enhanced the aesthetic value of the website. This article focuses on 2014 (more broadly 2011–2018) because this was the era before -core suffixes existed, Tumblr was at its greatest cultural relevancy, and the aesthetic trend was at its infancy.",Mid 2010s,,,,
After Hours,https://aesthetics.fandom.com/wiki/After_Hours,"After Hours is an aesthetic inspired by the forlorn atmosphere of empty or seemingly abandoned places that are usually bustling with people.  After Hours isn’t defined in terms of a specific artstyle or media, but instead by the imagery of various abandoned places such as empty streets, schools, and parks. However, the aesthetic is not limited to physical settings either; online settings such as abandoned blogs, empty game servers, and inactive websites can also elicit similar feelings.
The concept is built on the contrast between the memories or expectations associated with a place and the current reality of it being abandoned or devoid of human presence. These feelings, which have collectively been coined as kenopsia, include a mix of nostalgia, melancholy, and a sense of surrealism. The emptiness of the abandoned space and the remains of its former vitality can create a powerful emotional response. For some, it might cause them to reflect on the passage of time, the transience of life, or the impermanence of human activities. The always-present tranquility of After Hours distinguishes it from the adjacent aesthetic of Liminal Space, which is intentionally designed to be unsettling and foreboding.[1]
Several people who identify with this aesthetic like to explore such places, while others - such as graveyard shift workers - have no option but to be active during night. These night-crawlers love silence and quiet settings. Being away from everyone and everything is comforting to them.
The aesthetic is commonly seen in Post-Apocalyptic media to convey the effects of the world becoming empty.
Sometime about March 29th, 2015, John Koenig coined kenopsia for his online project, The Dictionary of Obscure Sorrows.[2][3][4][5]
Visuals for After Hours tend to be dimly lit public areas usually bustling with people, but are shown as empty. Photos usually have streetlights that are on 24/7 as the rest of the street is dark and lifeless. Unlike the Liminal Space aesthetic, these empty areas are not always intended to be unsettling; rather, they are supposed to invoke a feeling of rebelliousness and tranquility. To people that participate in this aesthetic, the late hours are mysterious and contemplative, a moment filled with the imagery of light poles, shady corners, clocks, trash blowing, quiet urban scenery, wanderers and cat's eyes lurking.
The visuals associated often convey a haunting and surreal atmosphere. When exploring abandoned or empty spaces or locations, certain visual elements tend to be highlighted. These visual elements can include decay, emptiness, silence, nostalgia, and stillness. Often these evoke feelings of despair or uneasiness. Anything with these characteristics is usually identified as evoking kenopsia. Often these things are also related to liminal spaces, so there is crossover in that regard.

After Hours activities usually involve interacting with empty public areas; whether it be traveling through or waiting for someone that may never come. Some activities related to After Hours are illegal or dangerous and will vary according to the urban area where it takes place.
These include:
Kenopsia has inspired various forms of media, including photography, literature, film, and art, where creators capture and convey the unique atmosphere associated with abandoned or desolate spaces. Some examples that utilize kenopsia include:
As an aesthetic based heavily on ambient, ambient-based, and adjacent music genres can be seen as complementary to this aesthetic. There are many ways one can communicate the feeling of kenopsia and some do through music by evoking feelings of emptiness, nostalgia, or solitude, similar associated things.",2010s,"Nighthawks, Edward Hopper","Darkness, emptiness, familiarity, tranquility, melancholy","Darker colors due to shadows, Gold, Yellow",
Angelcore,https://aesthetics.fandom.com/wiki/Angelcore,"Before the aesthetic community largely segmented itself off into aesthetic communities, people would ""find"" their aesthetic through tags which were based on adjectives and objects that described the photograph itself, rather than an entire community that comes with it. Of course, there are common terms that appeared, such as kawaii, hipster, and grunge, but the extent was not to the one in the late 2010s-2020s. From there, communities were centered around who was following who, without an established name that encompassed all the community. ""
""""And everyday / I am learning about you / The things that no one else sees / And the end comes too soon / Like dreaming of angels"""" -The XX, """"Angels""""

Angelcore is a contemporary aesthetic inspired by imagery and depictions of angels, and is the opposite adjacent aesthetic to Devilcore. It has an Ethereal vibe and is inspired by the Rococo era artwork; many of the old paintings with cherubs you find on Pinterest are Rococo.
The aesthetic is designed to emulate the same unearthly beauty that the European stereotype of angels are described and depicted with, though it can also include non-European angel aesthetics. This can be done with modern or older presentation methods.
It’s also worth noting that much of the angel mythology and imagery comes from multiple belief systems (from Greek paganism, to Judaism, to New Age, to the aforementioned Christianity). So there are no specific religious connections or connotations involved in an angelic aesthetic.
There is also an entirely Angelcore store in the Montmartre district of Paris, called La Boutique des Anges, Rue Yvonne le Tac no. 2. There are all kinds of designs with angels, mainly figures.
As an aesthetic based heavily on feeling, ambient-based and adjacent music genres can be seen as complementary to this aesthetic. Folk and classic piano are also popular.

The difference between cherubs (aka putti, singular putto) and angels are enough to warrant its own tag on various social media websites most notably Tumblr. Cherubcore focuses on the feelings and values portrayed by heavenly cherubs and the small, sweet, baby-like innocence of the figures that differ from the divine essence of angels. There is often a distinct crossover in this aesthetic with Babycore and Delicate Sweet, with a hint of Lovecore now and then due to the similarity between cherubs and the mythical figure Cupid. The visuals of cherubcore are the same as angelcore but add more fun visuals like candy, cherubs laughing in paintings, hearts, porcelain figures, and child's toys. There are lots of pinks and whites involved as well. Fashion has a very similar overlap to Coquette(especially gloomy coquette), and Babycore, with youthful and childlike articles of clothing and accessories. It is worth mentioning that the baby angels portrayed as cherubs in art and in this aesthetic are based off of ancient Greaco-Roman putti associated with the god Eros/Cupid, and not on the actual biblical portrayal of cherubs which is vastly different.

The Fallen Angel aesthetic, also known as dark/goth angelcore, takes angelcore and adds more somber themes and dark visual tones while still providing the essences of ethereal and other-worldy, similar to Dethereal. Many of the themes of fallen angel involve feelings of """"falling from grace"""" or unworthiness/not wanting to be placed on a pedestal like angels are commonly portrayed. The aesthetic itself can both exude feelings of peace and radiance or sorrow and malice depending on the camp presented. It is closely related to Devilcore and may even be considered the same thing.
Common motifs for fallen angels include angel statues, black wings, flowing white and/or black fabrics, fire, halos, horns and tails, the sky and the ground, snakes, and much more. Visually, there is a crossover with Dark Naturalism, which exhibits dark, misty visuals of nature. Other visuals can overlap with Traumacore and Grunge, employing angelic motifs mixed with heavy melancholy themes. Fashion takes regular angelcore and turns it black, almost Gothic. It can also take an aforementioned Grunge route. Baroque art may be seen as well, which has a darker tone than Rococo.
This aesthetic can focus on criticizing the Catholic religion, sharing similar aspects of reasoning with Sacricore. Common topics include excommunication, religious trauma, and mental illness. Often this is mixed with the aforementioned feelings of falling from grace or feeling tainted, and potentially being cast out of a religion or choosing to leave it.
Biblical Angels are taken from the biblical depiction of angels, rather than the altered humanistic version created by the media. There are various sections of the Bible where angels and cherubs are described, including Ezekiel 1:5-11, Isaiah 6:2, Job 38:7, Ps 8:5, Ac 26:13, and Re 1:20. These verses and many others describe angels as hot, pure energy, and frightening to humans. This is a popular subject in art and can be seen across media. Often times they are depicted as half human, half animal or as energy balls with a thousand eyes circling around it with six wings.
This subject focuses on the reality of divinity and the terrifying truth that had been covered up by mainstream society over history. The overall theme of the biblical angel aesthetic is questioning monstrosity and fear, and presenting truth to those living in ignorance. It is both ethereal and horrifying, and has a subcommunity for those who identify with these depictions. These communities also use their art of biblical angels to portray the previously mention themes, as well as humor. Being ethereal and mysterious, feeling """"too big your body"""", and a deep philosophical nature can accompany the moods of this aesthetic.""",2010s,"The Toilette of Venus, by François Boucher, 1751, oil on canvas; Les Génies des Arts, by François Boucher, 1761, oil on canvas; Fallen Angel, by Alexandre Cabanel, 1847, oil on canvas","Angels, cherubs, wings, doves, halos, softness, purity, metallic shimmer","White, gold, light blue, light yellow, light pink",
Anime New Moon,https://aesthetics.fandom.com/wiki/Anime_New_Moon,"Anime New Moon is an aesthetic based on a particular type of anime graphic design that was very prevalent during the mid-2000s to early 2010s and was often featured in the videos of Nightcore remixes of that time involving Trance music. Visually, it could be described as elegant, ethereal and slightly mysterious. Artworks relating to this aesthetic typically involve the night and other elements relating to it, like the moon, stars, moonlight, galaxies, etc., as well as mythological creatures relating to angels or vampires. It is a sister aesthetic of Technoneko2000, as both have influenced Nightcore as a whole.
The visuals found in the Anime New Moon aesthetic are all about nighttime and ethereal elements. The color palette of the aesthetic often uses multiple shades of blue (from pastel to navy), white, purple and pink. For instance, PicsArt, a popular image editing app, has an image filter called ""Nightcore""[1], which also uses this specific color palette associated with the Anime New Moon aesthetic. The aesthetic focuses on beautiful aspects of the night, like the moon, moonlight and stars, as well as other elements like galaxies or waterfalls. The characters featured in the images and edits are typically fantastic characters, like angels, vampires or magical girls. Other elements found in the aesthetic are white birds and butterflies. This aesthetic could ironically be described as taking the term 'nightcore' too literally.For example, for Pink Parisian, one of the aesthetics on that site, people would tag it #pink, #old-hollywood, #feminine, #romantic, #vintage, #parisian, etc. This led to some variation on what appeared in the search bar. For example, the search term ""pink"" could bring up Fairy Kei, Morute, Delicate Sweet, and Pink Parisian. Because of this difficulty in finding terms with consistent aesthetics and users, ""Follow Forevers"" existed. These were lists of users that someone would compile after reaching a certain number of followers. In effect, these popular users were influencers who allowed their followers to find their sources of inspiration, which united the aesthetic further and created a more tight-knit community. An example of a Follow Forever could be found here.",2000s,,"Anime characters, the moon, moonlight, stars, angels, starry nights, waterfalls","Blue, white, purple, pink",
Bastardcore,https://aesthetics.fandom.com/wiki/Bastardcore,"An aesthetic based on Gryffindor, from the Harry Potter series. Bastardcore is supposed to strike your fight or flight response. It consists of friendly images along with shock humor themed captions or images that seem out of place and are uncomfortable to look at. One could argue that Bastardcore is an extension of the ""cursed images'"" meme. This aesthetic is commonly used by people who would refer to themselves as ""feral[1]"".
Bastardcore visuals are designed to be shocking, mildly offensive by nature, and ""cursed"" by nature, all in an attempt to make other people as uncomfortable as humanly possible.
Bastardcore fashion can easily blend in with any other fashion-based aesthetics, common clothes and accessories include ripped jeans and graphic tees, hoodies with strange quotes on them, handmade earrings, and platform shoes or combat boots.
Popular TV programs and web video series with this aesthetic include:
Contrary to popular belief, classic television programs from the 1920s-1940s can also be classified as early or prototypical bastardcore. Prime examples include Tom and Jerry, Woody Woodpecker, The Marx Brothers, The Three Stooges, and Abbott and Costello.
Popular shorts that fall under this aesthetic include:
Films (often comedies with dark or edgy humor and/or a rebellious spirit mixed in with seemingly mundane or wholesome situations, though they don't strictly have to be comedic either, they could simply have an edgy or rebellious style for its time filled with dark satire or characters who behave in an edgy or rebellious manner) that best embody this aesthetic may include:
Directors and/or filmmakers whose material embodies the Bastardcore aesthetic may include:
Actors and actresses who are often typecast as characters who often embody traits of the Bastardcore aesthetic (usually in comedic works or if the actor or actress is cast in a comedic work) may usually include: (This doesn't reflect how the actor/actress behaves in real life, only when they portray a character on screen)
Activities often associated with followers of the Bastardcore aesthetic could include:",2000s-2010s,,"Possums, badly lit rooms, arresting statements, saying zoo wee mama",,
Bimbocore,https://aesthetics.fandom.com/wiki/Bimbocore,"Fandom aesthetics are mood boards, playlists, and edits done based off of the aesthetic of a piece of media with a fandom. Users would take distinct visuals, colors, and attitudes associated with the setting of the work or a distinctive character design. These images would be arranged into either a square grid of nine photos or two columns that can span for however long the user sees fit. Bimbocore is an hyperfeminine aesthetic centered around pink and glitter, sexuality, old 2000s photos and hyperpop; sometimes rock or punk music with a bad girl theme, and pink things. The fashion style specifically is centered around body positivity for women, sexual appeal, and pink, Barbie-doll-like charm. Sometimes it can even go as far as attempting to become a ‘living Barbie doll’ through the use of extreme makeup and plastic surgery to achieve the perfect doll-like sexiness.
The term ""Bimbocore"" was coined in 2022 by Hannah Rose Collins, better known by her stage name Scene Queen, which she created as a subgenre of Metalcore with elements of Alternative Rock and Pop as well as hyperfeminine aesthetics. It would also serve as the name of her eponymous E.P: Bimbocore. It would later spread to TikTok as an aesthetic including many other songs and musical genres, like Bimbo Doll by Tila Tsoli.
The style is mainly inspired by the 2000s McBling aesthetic as well as Barbiecore. It is very similar to Bubblegum Bitch, which is also inspired by these, except that it lacks the same level of bad bitch, ""fuck this"" energy. There is also a connection to the baddie subtype of the Babygirl aesthetic as well as Bubblegum Coquette. It is also somewhat related to Stripcore.
Bimbocore is related to ‘Bimbofication’ which has two meanings. The first is a BDSM kink where someone (usually a woman; for a man it would be sissification), is transformed into a stereotypical airheaded slut perfectly happy to be used (consensually). The second type is a feminist movement among Gen-Z relating to taking back femininity by adopting a hyperfeminine style and pretending to be a dumb bimbo to manipulate men.
The fashion of Bimbocore is mainly inspired by 2000s fashion.
A term for members of the Goth subculture and/or E-Girls that embrace elements from both aesthetics to create a look that is both edgy and glamorous. It generally features dark body-conscious outfits, visible cleavage, shiny/latex corsets, gemstone chokers, bondage elements, and dramatic makeup with bold eyeliner and plump lips. This style is highly associated with the ""big titty goth GF"" meme as well as the Dark Babygirl aesthetic.
Winter Bimbo, also known as Winter Fairy Coquette is a subtype of both Bimbocore and Coquette as well as including aspects of other aesthetics like Snowdrop, Pink Christmas, Slavic Dolls, Snow Bunny, and Fairy Grunge.
Himbocore is the aesthetic centering around Himbos, the male counterpart to the Bimbo. This aesthetic can range from looking very similar to Bimbocore (except with less overt femininity), to being extremely hyper-masculine.
Slutcore is an even more explicitly sexual version of Bimbocore.",2020s,,"Doll brands, fashion, glitter, hyperfeminity","Pink, Magenta",
Blingeecore,https://aesthetics.fandom.com/wiki/Blingeecore,"Blingeecore, sometimes also called Glittercore, is an internet aesthetic based around the nostalgia and revival of old GIF graphics originating from websites such as Blingee or PicMix. Its iconic visuals represent Blingee stamps and layered images featuring motifs such as sparkles, glitter, stars, typical Emo art, floral graphics, etc. Generally, Blingeecore is often associated with the Scene and Animecore aesthetics, but not necessarily.
The timeless style of Blingee and PicMix GIFs also influenced a lot of online art movements and aesthetics, most notably Scene art, Sigilkore and Draincore. Although once considered tacky, many people still appreciate and enjoy the filters and special effects from said apps, leading to the style growing into its own aesthetic and making a comeback due to nostalgia. It is worth mentioning some Blingeecore images and GIFs have the potential to cause eyestrain or seizures due to their flashing visuals.
Most Blingeecore images and edits come in a GIF format, but the aesthetic is often also applied to regular images. Blingeecore visuals may be considered kitsch by many people due to their flashing and low quality style. For example, a fan of Harley Quinn would make a mood board that has an image of a playing card, smudged lipstick, a quote about toxic love, and a strong use of the color red. One of the most popular examples, and arguably a precursor to Dark Academia, are the Harry Potter mood boards, which were very popular due to the diversity of themes such as Hogwarts Houses or important buildings.",Mid-2000s,,"Blingee stamps, sparkles, glitter, floral graphics, Emo art, anime characters, skulls, butterflies, stars, hearts, checkered patterns","Fuchsia, black, white, purple",
Bloomcore,https://aesthetics.fandom.com/wiki/Bloomcore,"Bloomcore, also known as Floral, is an aesthetic based on theme of flowers, gardens, gardening, and nature. Though generally similar, Bloomcore differs from the more general Naturecore in its focus on village greenery, emphasis of flowers, and themes of a quiet lifestyle. It is mostly associated with springtime.
Bloomcore visuals include:
Bloomcore fashion is flexible since it hasn't fully been established. This makes it easy to mix with other aesthetics. More popular bloomcore styles are mixed with Cottagecore, Light Academia, and Grunge. Other elements could include:
Activities can be similar to Cottagecore.
Meadowcore is an aesthetic centered around meadows. It is related to Cottagecore, Bloomcore, and Honeycore. Motifs include picnics, Golden Hour, flowers, and wide fields of grass or flowers.
Petalcore is an aesthetic centered around flowers, romance and sometimes muted colors, similar to Romantic Academia. Some noticeable motifs and values centered of this aesthetic are, unsurprisingly, flowers and romance.The people who create these fandom mood boards were expressing their love of the fandom and both the aesthetic community and the fandom would reblog their work. The presence of fandom mood boards have diminished in the following years, largely because of the rise of aesthetics that are unaffiliated with fiction, the general loss of fangirl enthusiasm (see the section on Dashcon for a better explanation), and migration to other websites.",Possibly 2010s,,"Gardens, flowers, fresh fruit, spring","Bright colors, pastels, green and white",
Busukawaii,https://aesthetics.fandom.com/wiki/Busukawaii,"Busukawaii (ぶさかわいい or ブサカワ) is a Japanese aesthetic that revolves around an ugly but a somehow charming or cute appearance. It is also often used in a joking manner as part of memes.
The main visual focus of Busukawaii is plain or strange-looking characters combined with themes that are typical for the Kawaii aesthetic. Many of them were created precisely with this adorable ugliness in mind as their own unique charm point.
Image edits of pre-existing characters are also very popular. There are many soft pastel filters, glitter, sparkles, and other cute imagery for the purpose of creating a kawaii atmosphere, leaving a kind of bizarre impression.
Bootleg anime merchandise are also occasionally featured as a photography subject within the aesthetic due to the frequent occurence of off-kilter faces on usually cute characters.This also applied to other subjects, such as MBTI types, zodiac signs, and colors. Users often sent requests through asks, and the person on the blog would create their own interpretation. For example, ""I love your blog! I am Slytherin, INTP, and Libra."" The user would then combine all of those elements into one moodboard like the one to the right.",2000s,,,Primary and pastel colors,
Castlecore,https://aesthetics.fandom.com/wiki/Castlecore,"Castlecore is an aesthetic inspired by the Medieval era and derives from the Gothic and Knightcore aesthetics, with a modern trendy twist. It is very similar to FantasY2K with how it combines Medieval and modern styles.",2020s,,"Chain mail, Gothic castles, silver jewelry, medieval art, medieval-style dresses","Silver, black, jewel tones",
